{
  "schemaVersion": 2,
  "mediaType": "application/vnd.oci.image.manifest.v1+json",
  "config": {
    "mediaType": "application/vnd.skill-registry.config.v1+json",
    "digest": "sha256:0000000000000000000000000000000000000000000000000000000000000000",
    "size": 0
  },
  "layers": [
    {
      "mediaType": "application/vnd.skill-registry.skill.layer.v1.tar+gzip",
      "digest": "sha256:0000000000000000000000000000000000000000000000000000000000000000",
      "size": 0,
      "annotations": {
        "org.opencontainers.image.title": "example-skill.tar.gz"
      }
    }
  ],
  "annotations": {
    "org.opencontainers.image.title": "example-skill",
    "org.opencontainers.image.version": "0.0.0",
    "urn.skill-registry.canonical-name": "example-skill",
    "urn.skill-registry.resource-id": "UNVERIFIED_DOCUMENTATION_FIXTURE",
    "urn.skill-registry.catalog-snapshot-sha256": "0000000000000000000000000000000000000000000000000000000000000000",
    "urn.skill-registry.example-status": "DOCUMENTATION_ONLY_NOT_A_PACKAGE"
  }
}
